<?xml version="1.0" encoding="UTF-8"?>
<!--

       Copyright 2009-2023 the original author or authors.

       Licensed under the Apache License, Version 2.0 (the "License");
       you may not use this file except in compliance with the License.
       You may obtain a copy of the License at

          https://www.apache.org/licenses/LICENSE-2.0

       Unless required by applicable law or agreed to in writing, software
       distributed under the License is distributed on an "AS IS" BASIS,
       WITHOUT WARRANTIES OR CONDITIONS OF ANY KIND, either express or implied.
       See the License for the specific language governing permissions and
       limitations under the License.

-->
<!DOCTYPE mapper PUBLIC "-//mybatis.org//DTD Mapper 3.0//EN"
    "https://mybatis.org/dtd/mybatis-3-mapper.dtd">
<mapper namespace="pet namespace">
    <cache />
    <resultMap type="org.apache.ibatis.submitted.xml_external_ref.Pet"
        id="petResult">
        <id property="id" column="pet_id" />
        <result property="ownerId" column="owner_id" />
        <result property="name" column="pet_name" />
    </resultMap>
    <resultMap type="org.apache.ibatis.submitted.xml_external_ref.Pet"
        id="resultWithOwner" extends="petResult">
        <association property="owner"
            javaType="org.apache.ibatis.submitted.xml_external_ref.Person"
            resultMap="person namespace.personResult" />
    </resultMap>
    <sql id="petColumnList">
        pet_id, owner_id, pet_name
    </sql>
    <select id="select" parameterType="java.lang.Integer" resultMap="resultWithOwner">
        SELECT
        <include refid="petColumnList" />
        ,
        <include refid="person namespace.personColumnList" />
        FROM pet, person where person_id = owner_id
        AND pet_id = #{id}
    </select>
</mapper>
