<?xml version="1.0" encoding="UTF-8"?>
<!--

       Copyright 2009-2023 the original author or authors.

       Licensed under the Apache License, Version 2.0 (the "License");
       you may not use this file except in compliance with the License.
       You may obtain a copy of the License at

          https://www.apache.org/licenses/LICENSE-2.0

       Unless required by applicable law or agreed to in writing, software
       distributed under the License is distributed on an "AS IS" BASIS,
       WITHOUT WARRANTIES OR CONDITIONS OF ANY KIND, either express or implied.
       See the License for the specific language governing permissions and
       limitations under the License.

-->
<!DOCTYPE mapper PUBLIC "-//mybatis.org//DTD Mapper 3.0//EN"
    "https://mybatis.org/dtd/mybatis-3-mapper.dtd">
<mapper namespace="person namespace">
    <cache-ref namespace="pet namespace" />
    <resultMap type="org.apache.ibatis.submitted.xml_external_ref.Person"
        id="personResult">
        <id property="id" column="person_id" />
        <result property="name" column="person_name" />
    </resultMap>
    <resultMap type="org.apache.ibatis.submitted.xml_external_ref.Person"
        id="resultWithPets" extends="personResult">
        <collection property="pets"
            ofType="org.apache.ibatis.submitted.xml_external_ref.Pet" resultMap="pet namespace.petResult" />
    </resultMap>
    <sql id="personColumnList">
        person_id, person_name
    </sql>
    <!-- Referencing a sql fragment in another file -->
    <select id="select" parameterType="java.lang.Integer" resultMap="resultWithPets">
        SELECT
        <include refid="personColumnList" />
        ,
        <include refid="pet namespace.petColumnList" />
        FROM person, pet
        WHERE person_id = #{id}
        AND person_id = owner_id
        ORDER
        BY pet_id
    </select>
    <!-- Referencing a sql fragment and a result map in another file -->
    <select id="selectPet" parameterType="java.lang.Integer"
        resultMap="pet namespace.petResult">
        SELECT
        <include refid="pet namespace.petColumnList" />
        FROM pet
        WHERE pet_id = #{id}
    </select>
</mapper>
