<?xml version="1.0" encoding="UTF-8"?>
<!--

       Copyright 2009-2023 the original author or authors.

       Licensed under the Apache License, Version 2.0 (the "License");
       you may not use this file except in compliance with the License.
       You may obtain a copy of the License at

          https://www.apache.org/licenses/LICENSE-2.0

       Unless required by applicable law or agreed to in writing, software
       distributed under the License is distributed on an "AS IS" BASIS,
       WITHOUT WARRANTIES OR CONDITIONS OF ANY KIND, either express or implied.
       See the License for the specific language governing permissions and
       limitations under the License.

-->
<!DOCTYPE mapper
    PUBLIC "-//mybatis.org//DTD Mapper 3.0//EN"
    "https://mybatis.org/dtd/mybatis-3-mapper.dtd">

<mapper namespace="org.apache.ibatis.submitted.foreach.Mapper">

    <select id="getUser" resultType="org.apache.ibatis.submitted.foreach.User">
        select * from users
         WHERE id in (
        <foreach item="item" index="index" collection="friendList"
          separator="," >
          #{item.id}
        </foreach>
        )
    </select>

  <select id="countByUserList" resultType="_int" parameterType="list">
    select count(*) from users
      <where>
        id in
        <foreach item="item" collection="list" separator="," open="(" close=")">
          #{item.id, jdbcType=NUMERIC}
        </foreach>
      </where>
  </select>

  <select id="countByBestFriend" resultType="_int" parameterType="list">
    select count(*) from users
      <where>
        id in
        <foreach item="item" collection="list" separator="," open="(" close=")">
          #{item.bestFriend.id, jdbcType=NUMERIC}
        </foreach>
      </where>
  </select>

  <select id="selectWithNullItemCheck" resultType="string">
    select name from users
      <where>
        id in
        <foreach item="item" collection="list" separator="," open="(" close=")">
          <if test="item != null">
            #{item.id, jdbcType=NUMERIC}
          </if>
        </foreach>
      </where>
  </select>

  <insert id="typoInItemProperty">
    insert into users (id, name) values
    <foreach item="item" collection="list" separator=",">
        (#{item.idd}, #{item.name})
    </foreach>
  </insert>

  <select id="itemVariableConflict" resultType="_int">
    select count(*) from users where id in
    <foreach collection="ids" item="id" open="(" close=")" separator=",">
      <foreach collection="ids2" item="id">
        #{id},
      </foreach>
      #{id}
    </foreach>
    or id = #{id}
  </select>

  <select id="indexVariableConflict" resultType="_int">
    select count(*) from users where id in
    <foreach collection="idxs" index="idx" open="(" close=")" separator=",">
      <foreach collection="idxs2" index="idx">
        #{idx},
      </foreach>
      #{idx} + 2
    </foreach>
    or id = #{idx}
  </select>

  <select id="countUserWithNullableIsOmit" resultType="_int">
    select count(*) from users
    <where>
      <foreach item="item" index="index" collection="friendList" open="id in ("
               separator="," close=")">
        #{item.id}
      </foreach>
    </where>
  </select>

  <select id="countUserWithNullableIsTrue" resultType="_int">
    select count(*) from users
    <where>
      <foreach item="item" index="index" collection="friendList" nullable="true" open="id in ("
               separator="," close=")">
        #{item.id}
      </foreach>
    </where>
  </select>

  <select id="countUserWithNullableIsFalse" resultType="_int">
    select count(*) from users
    <where>
      <foreach item="item" index="index" collection="friendList" nullable="false" open="id in ("
               separator="," close=")">
        #{item.id}
      </foreach>
    </where>
  </select>
</mapper>
