<?xml version="1.0" encoding="UTF-8" standalone="no"?>
<!--

       Copyright 2009-2023 the original author or authors.

       Licensed under the Apache License, Version 2.0 (the "License");
       you may not use this file except in compliance with the License.
       You may obtain a copy of the License at

          https://www.apache.org/licenses/LICENSE-2.0

       Unless required by applicable law or agreed to in writing, software
       distributed under the License is distributed on an "AS IS" BASIS,
       WITHOUT WARRANTIES OR CONDITIONS OF ANY KIND, either express or implied.
       See the License for the specific language governing permissions and
       limitations under the License.

-->
<!DOCTYPE mapper
    PUBLIC "-//mybatis.org//DTD Mapper 3.0//EN"
    "https://mybatis.org/dtd/mybatis-3-mapper.dtd">

<mapper namespace="">

    <resultMap id="personMap" type="Person">
        <id property="id" column="id"/>
        <result property="firstName" column="firstName"/>
        <result property="lastName" column="lastName"/>
    </resultMap>


    <select id="selectAllByType" resultMap="personMap" parameterType="org.apache.ibatis.submitted.ognl_enum.Person$Type">
        SELECT id, firstName, lastName, personType
        FROM person
        <where>
            <if test="_parameter != null and _parameter.toString() == 'EMPLOYEE'">
                AND personType = #{type}
            </if>
            <if test="_parameter != null and _parameter.toString() == 'DIRECTOR'">
                AND personType = #{type}
            </if>
        </where>
    </select>
    <select id="selectAllByTypeNameAttribute" resultMap="personMap" parameterType="org.apache.ibatis.submitted.ognl_enum.Person$Type">
        SELECT id, firstName, lastName, personType
        FROM person
        <where>
            <if test="name == 'EMPLOYEE'">
                AND personType = #{type}
            </if>
            <if test="name == 'DIRECTOR'">
                AND personType = #{type}
            </if>
        </where>
    </select>

    <select id="selectAllByTypeWithInterface" resultMap="personMap" parameterType="org.apache.ibatis.submitted.ognl_enum.PersonMapper$PersonType">
        SELECT id, firstName, lastName, personType
        FROM person
        <where>
            <if test="type.toString() == 'EMPLOYEE'">
                AND personType = #{type}
            </if>
            <if test="type.toString() == 'DIRECTOR'">
                AND personType = #{type}
            </if>
        </where>
    </select>
    <select id="selectAllByTypeNameAttributeWithInterface" resultMap="personMap" parameterType="org.apache.ibatis.submitted.ognl_enum.PersonMapper$PersonType">
        SELECT id, firstName, lastName, personType
        FROM person
        <where>
            <if test="type.toString() == 'EMPLOYEE'">
                AND personType = #{type}
            </if>
            <if test="type.toString() == 'DIRECTOR'">
                AND personType = #{type}
            </if>
        </where>
    </select>
</mapper>
