<?xml version="1.0" encoding="UTF-8"?>
<!--

       Copyright 2009-2023 the original author or authors.

       Licensed under the Apache License, Version 2.0 (the "License");
       you may not use this file except in compliance with the License.
       You may obtain a copy of the License at

          https://www.apache.org/licenses/LICENSE-2.0

       Unless required by applicable law or agreed to in writing, software
       distributed under the License is distributed on an "AS IS" BASIS,
       WITHOUT WARRANTIES OR CONDITIONS OF ANY KIND, either express or implied.
       See the License for the specific language governing permissions and
       limitations under the License.

-->
<!DOCTYPE mapper
    PUBLIC "-//mybatis.org//DTD Mapper 3.0//EN"
    "https://mybatis.org/dtd/mybatis-3-mapper.dtd">

<mapper namespace="org.apache.ibatis.submitted.lazy_properties.Mapper">

  <resultMap type="org.apache.ibatis.submitted.lazy_properties.User"
    id="user">
    <id property="id" column="id" />
    <result property="name" column="name" />
  </resultMap>

  <resultMap type="org.apache.ibatis.submitted.lazy_properties.User"
    id="userWithLazyProperties" extends="user">
    <association property="lazy1" column="id" select="getLazy1"
      fetchType="lazy" />
    <association property="lazy2" column="id" select="getLazy2"
      fetchType="lazy" />
    <collection property="lazy3" column="id" select="getLazy3"
      fetchType="lazy" />
  </resultMap>

  <select id="getUser" resultMap="userWithLazyProperties">
    select * from users where id =
    #{id}
  </select>

</mapper>
