<?xml version="1.0" encoding="UTF-8"?>
<!--

       Copyright 2009-2023 the original author or authors.

       Licensed under the Apache License, Version 2.0 (the "License");
       you may not use this file except in compliance with the License.
       You may obtain a copy of the License at

          https://www.apache.org/licenses/LICENSE-2.0

       Unless required by applicable law or agreed to in writing, software
       distributed under the License is distributed on an "AS IS" BASIS,
       WITHOUT WARRANTIES OR CONDITIONS OF ANY KIND, either express or implied.
       See the License for the specific language governing permissions and
       limitations under the License.

-->
<!DOCTYPE mapper PUBLIC "-//mybatis.org//DTD Mapper 3.0//EN" "https://mybatis.org/dtd/mybatis-3-mapper.dtd" >
<mapper namespace="org.apache.ibatis.submitted.nestedresulthandler_association.AccountRepository">
    <resultMap id="resultMapAccount" type="org.apache.ibatis.submitted.nestedresulthandler_association.Account">
        <id property="accountUuid" column="account_uuid" />
        <result property="accountName" column="account_name" />
        <result property="birthDate" column="birth_date" />
        <association property="address" javaType="org.apache.ibatis.submitted.nestedresulthandler_association.AccountAddress">
            <id property="accountUuid" column="account_uuid" />
            <result property="zipCode" column="zip_code" />
            <result property="address" column="address" />
        </association>
    </resultMap>
    <select id="collectPageByBirthMonth" resultMap="resultMapAccount" resultOrdered="true">
        <![CDATA[
        SELECT
          a.account_uuid
          ,a.account_name
          ,a.birth_date
          ,aa.zip_code
          ,aa.address
        FROM
          t_account a
        LEFT OUTER JOIN
          t_account_address aa
            ON aa.account_uuid = a.account_uuid
        WHERE
          a.birth_date >= #{birthMonth} AND a.birth_date < ADD_MONTHS(#{birthMonth}, 1)
        ORDER BY
          a.account_uuid
        ]]>
    </select>
</mapper>
