<?xml version="1.0" encoding="UTF-8"?>
<!--

       Copyright 2009-2023 the original author or authors.

       Licensed under the Apache License, Version 2.0 (the "License");
       you may not use this file except in compliance with the License.
       You may obtain a copy of the License at

          https://www.apache.org/licenses/LICENSE-2.0

       Unless required by applicable law or agreed to in writing, software
       distributed under the License is distributed on an "AS IS" BASIS,
       WITHOUT WARRANTIES OR CONDITIONS OF ANY KIND, either express or implied.
       See the License for the specific language governing permissions and
       limitations under the License.

-->
<!DOCTYPE mapper
    PUBLIC "-//mybatis.org//DTD Mapper 3.0//EN"
    "https://mybatis.org/dtd/mybatis-3-mapper.dtd">

<mapper
  namespace="org.apache.ibatis.submitted.constructor_columnprefix.Mapper">

  <resultMap id="keyRM"
    type="org.apache.ibatis.submitted.constructor_columnprefix.EntityKey">
    <id property="id" column="id" />
  </resultMap>

  <resultMap id="authorRM"
    type="org.apache.ibatis.submitted.constructor_columnprefix.Author">
    <id property="id" column="id" />
  </resultMap>

  <resultMap id="articleRM"
    type="org.apache.ibatis.submitted.constructor_columnprefix.Article">
    <constructor>
      <idArg resultMap="keyRM" columnPrefix="key_"
        javaType="org.apache.ibatis.submitted.constructor_columnprefix.EntityKey" />
      <arg column="name" javaType="string" />
      <arg resultMap="authorRM" columnPrefix="author_"
        javaType="org.apache.ibatis.submitted.constructor_columnprefix.Author" />
      <arg resultMap="authorRM" columnPrefix="coauthor_"
        javaType="org.apache.ibatis.submitted.constructor_columnprefix.Author" />
    </constructor>
  </resultMap>

  <select id="getArticles" resultMap="articleRM"><![CDATA[
    select id key_id, name, author.id author_id, author.name author_name,
      coauthor.id coauthor_id, coauthor.name coauthor_name
    from articles
    left join authors author on author.id = articles.author_id
    left join authors coauthor on coauthor.id = articles.coauthor_id
    order by articles.id
  ]]></select>

</mapper>
