<?xml version="1.0" encoding="UTF-8" standalone="no"?>
<!--

       Copyright 2009-2023 the original author or authors.

       Licensed under the Apache License, Version 2.0 (the "License");
       you may not use this file except in compliance with the License.
       You may obtain a copy of the License at

          https://www.apache.org/licenses/LICENSE-2.0

       Unless required by applicable law or agreed to in writing, software
       distributed under the License is distributed on an "AS IS" BASIS,
       WITHOUT WARRANTIES OR CONDITIONS OF ANY KIND, either express or implied.
       See the License for the specific language governing permissions and
       limitations under the License.

-->
<!DOCTYPE mapper
    PUBLIC "-//mybatis.org//DTD Mapper 3.0//EN"
    "https://mybatis.org/dtd/mybatis-3-mapper.dtd">

<mapper namespace="org.apache.ibatis.submitted.enumtypehandler_on_map.PersonMapper">

    <resultMap id="personMap" type="Person">
        <id property="id" column="Person_id"/>
        <result property="firstName" column="Person_firstName"/>
        <result property="lastName" column="Person_lastName"/>
    </resultMap>


    <sql id="columns">
        Person.id AS Person_id,
        Person.firstName AS Person_firstName,
        Person.lastName AS Person_lastName,
        Person.personType AS Person_personType
    </sql>


    <select id="getByType" resultMap="personMap" parameterType="map">
        SELECT <include refid="columns"/>
        FROM Person
        WHERE personType = #{type,jdbcType=VARCHAR}
    </select>
    <select id="getByTypeNoParam" resultMap="personMap" parameterType="org.apache.ibatis.submitted.enumtypehandler_on_map.PersonMapper$TypeName">
        SELECT <include refid="columns"/>
        FROM Person
        WHERE personType = #{type,jdbcType=VARCHAR}
    </select>

</mapper>
